{
  "stage": "RELEASE_LEDGER",
  "status": "passed",
  "generated_at": "2026-04-21T11:56:48.452Z",
  "entries": [
    {
      "ledger_entry_id": "ledger-sandbox_publish_optional-1776579056350-6d3c4c",
      "run_id": "recovered-2026-04-19-sandbox-publish-optional-dnnpka",
      "item_id": "dnnpkaefmlhacigijccbhemgaenjbcpk",
      "publisher_id": "7462c8f7-9c1a-48ed-9249-894c0317bd46",
      "item_name": null,
      "package_sha256": "",
      "manifest_version": null,
      "action_type": "sandbox_publish_optional",
      "action_source": "api",
      "action_status": "PENDING_REVIEW",
      "occurred_at": "2026-04-19T06:10:56.346Z",
      "evidence_artifacts": [],
      "evidence_hashes": {},
      "chrome_webstore_response_summary": null,
      "dashboard_manual_note": "Recovered manual record for sandbox publish_optional that was overwritten by fixed run id before immutability was implemented",
      "approved_by": null,
      "approval_artifact": null,
      "production_write": false,
      "sandbox_only": true,
      "evidence_quality": "manual_reconstructed",
      "original_artifact_available": false,
      "recovery_reason": "fixed_run_id_overwrite",
      "redaction_checks": {
        "sanitized_response_bodies": true,
        "checked_secret_value_count": 0,
        "secret_values_present_in_artifact": false,
        "authorization_header_pattern_present": false,
        "key_material_pattern_present": false,
        "secret_marker_pattern_present": false,
        "redaction_guard_triggered": false
      }
    },
    {
      "ledger_entry_id": "ledger-manual_cancel_review-1776579056477-7ef4ef",
      "run_id": "recovered-2026-04-19-sandbox-publish-optional-dnnpka",
      "item_id": "dnnpkaefmlhacigijccbhemgaenjbcpk",
      "publisher_id": "7462c8f7-9c1a-48ed-9249-894c0317bd46",
      "item_name": null,
      "package_sha256": "",
      "manifest_version": null,
      "action_type": "manual_cancel_review",
      "action_source": "dashboard_manual",
      "action_status": "observed",
      "occurred_at": "2026-04-19T06:10:56.477Z",
      "evidence_artifacts": [],
      "evidence_hashes": {},
      "chrome_webstore_response_summary": null,
      "dashboard_manual_note": "User cancelled Chrome Web Store review from dashboard",
      "approved_by": null,
      "approval_artifact": null,
      "production_write": false,
      "sandbox_only": true,
      "evidence_quality": "manual_record",
      "original_artifact_available": true,
      "recovery_reason": null,
      "redaction_checks": {
        "sanitized_response_bodies": true,
        "checked_secret_value_count": 0,
        "secret_values_present_in_artifact": false,
        "authorization_header_pattern_present": false,
        "key_material_pattern_present": false,
        "secret_marker_pattern_present": false,
        "redaction_guard_triggered": false
      }
    },
    {
      "ledger_entry_id": "ledger-manual_cancel_review-1776579114275-8c2881",
      "run_id": "recovered-2026-04-19-sandbox-publish-optional-dnnpka",
      "item_id": "dnnpkaefmlhacigijccbhemgaenjbcpk",
      "publisher_id": "7462c8f7-9c1a-48ed-9249-894c0317bd46",
      "item_name": null,
      "package_sha256": "",
      "manifest_version": null,
      "action_type": "manual_cancel_review",
      "action_source": "dashboard_manual",
      "action_status": "observed",
      "occurred_at": "2026-04-19T06:11:54.273Z",
      "evidence_artifacts": [],
      "evidence_hashes": {},
      "chrome_webstore_response_summary": null,
      "dashboard_manual_note": "User cancelled Chrome Web Store review from dashboard",
      "approved_by": null,
      "approval_artifact": null,
      "production_write": false,
      "sandbox_only": true,
      "evidence_quality": "manual_record",
      "original_artifact_available": true,
      "recovery_reason": null,
      "redaction_checks": {
        "sanitized_response_bodies": true,
        "checked_secret_value_count": 0,
        "secret_values_present_in_artifact": false,
        "authorization_header_pattern_present": false,
        "key_material_pattern_present": false,
        "secret_marker_pattern_present": false,
        "redaction_guard_triggered": false
      }
    },
    {
      "ledger_entry_id": "ledger-manual_cancel_review-1776579186214-7ff2fb",
      "run_id": "recovered-2026-04-19-sandbox-publish-optional-dnnpka",
      "item_id": "dnnpkaefmlhacigijccbhemgaenjbcpk",
      "publisher_id": "7462c8f7-9c1a-48ed-9249-894c0317bd46",
      "item_name": null,
      "package_sha256": "",
      "manifest_version": null,
      "action_type": "manual_cancel_review",
      "action_source": "dashboard_manual",
      "action_status": "observed",
      "occurred_at": "2026-04-19T06:13:06.213Z",
      "evidence_artifacts": [],
      "evidence_hashes": {},
      "chrome_webstore_response_summary": null,
      "dashboard_manual_note": "User cancelled Chrome Web Store review from dashboard",
      "approved_by": null,
      "approval_artifact": null,
      "production_write": false,
      "sandbox_only": true,
      "evidence_quality": "manual_reconstructed",
      "original_artifact_available": false,
      "recovery_reason": "fixed_run_id_overwrite",
      "redaction_checks": {
        "sanitized_response_bodies": true,
        "checked_secret_value_count": 0,
        "secret_values_present_in_artifact": false,
        "authorization_header_pattern_present": false,
        "key_material_pattern_present": false,
        "secret_marker_pattern_present": false,
        "redaction_guard_triggered": false
      }
    },
    {
      "ledger_entry_id": "ledger-promote_to_sandbox_validation-1776581491776-a7ca3c",
      "run_id": "sandbox-2026-04-19-145131-dnnpkaefmlha-1acd61",
      "source_run_id": "2026-04-19-145118-daily-4df0e2",
      "sandbox_run_id": "sandbox-2026-04-19-145131-dnnpkaefmlha-1acd61",
      "item_id": "dnnpkaefmlhacigijccbhemgaenjbcpk",
      "publisher_id": "7462c8f7-9c1a-48ed-9249-894c0317bd46",
      "item_name": "Lead Form Helper",
      "package_sha256": "448daa21629907ff19335455fe90b63c140496fa478bad96986e38b2d85bdc6b",
      "manifest_version": "0.1.0",
      "action_type": "promote_to_sandbox_validation",
      "action_source": "cli",
      "action_status": "passed",
      "occurred_at": "2026-04-19T06:51:31.736Z",
      "evidence_artifacts": [
        "runs/sandbox-2026-04-19-145131-dnnpkaefmlha-1acd61/83_sandbox_validation_plan.json"
      ],
      "evidence_hashes": {
        "runs/sandbox-2026-04-19-145131-dnnpkaefmlha-1acd61/83_sandbox_validation_plan.json": "deb1c47cb89d3da917637437758a0c16d47194772aa1e8963afd78a620cae1d3"
      },
      "chrome_webstore_response_summary": null,
      "dashboard_manual_note": null,
      "approved_by": null,
      "approval_artifact": null,
      "production_write": false,
      "sandbox_only": true,
      "evidence_quality": "direct_artifact",
      "original_artifact_available": true,
      "recovery_reason": null,
      "redaction_checks": {
        "sanitized_response_bodies": true,
        "checked_secret_value_count": 0,
        "secret_values_present_in_artifact": false,
        "authorization_header_pattern_present": false,
        "key_material_pattern_present": false,
        "secret_marker_pattern_present": false,
        "redaction_guard_triggered": false
      }
    },
    {
      "ledger_entry_id": "ledger-sandbox_upload_approval-1776581509783-c7ebbe",
      "run_id": "sandbox-2026-04-19-145131-dnnpkaefmlha-1acd61",
      "source_run_id": "2026-04-19-145118-daily-4df0e2",
      "sandbox_run_id": "sandbox-2026-04-19-145131-dnnpkaefmlha-1acd61",
      "item_id": "dnnpkaefmlhacigijccbhemgaenjbcpk",
      "publisher_id": "7462c8f7-9c1a-48ed-9249-894c0317bd46",
      "item_name": null,
      "package_sha256": "448daa21629907ff19335455fe90b63c140496fa478bad96986e38b2d85bdc6b",
      "manifest_version": "0.1.0",
      "action_type": "sandbox_upload_approval",
      "action_source": "cli",
      "action_status": "approved",
      "occurred_at": "2026-04-19T06:51:49.781Z",
      "evidence_artifacts": [
        "state/run_events/sandbox-2026-04-19-145131-dnnpkaefmlha-1acd61/82_human_approval.json"
      ],
      "evidence_hashes": {
        "state/run_events/sandbox-2026-04-19-145131-dnnpkaefmlha-1acd61/82_human_approval.json": "d67eb98072c33ec857694e4ba1667660940093fcd11c1565e741f8c8c0588298"
      },
      "chrome_webstore_response_summary": null,
      "dashboard_manual_note": null,
      "approved_by": "TMT2",
      "approval_artifact": "state/run_events/sandbox-2026-04-19-145131-dnnpkaefmlha-1acd61/82_human_approval.json",
      "production_write": false,
      "sandbox_only": true,
      "evidence_quality": "direct_artifact",
      "original_artifact_available": true,
      "recovery_reason": null,
      "redaction_checks": {
        "sanitized_response_bodies": true,
        "checked_secret_value_count": 0,
        "secret_values_present_in_artifact": false,
        "authorization_header_pattern_present": false,
        "key_material_pattern_present": false,
        "secret_marker_pattern_present": false,
        "redaction_guard_triggered": false
      }
    },
    {
      "ledger_entry_id": "ledger-fetch_status-1776582601315-901e9c",
      "run_id": "sandbox-2026-04-19-145131-dnnpkaefmlha-1acd61",
      "source_run_id": null,
      "sandbox_run_id": null,
      "item_id": "dnnpkaefmlhacigijccbhemgaenjbcpk",
      "publisher_id": "7462c8f7-9c1a-48ed-9249-894c0317bd46",
      "item_name": "Lead Form Helper",
      "package_sha256": "448daa21629907ff19335455fe90b63c140496fa478bad96986e38b2d85bdc6b",
      "manifest_version": null,
      "action_type": "fetch_status",
      "action_source": "cli",
      "action_status": "passed",
      "occurred_at": "2026-04-19T07:10:01.313Z",
      "evidence_artifacts": [
        "state/run_events/sandbox-2026-04-19-145131-dnnpkaefmlha-1acd61/90_publish_execution.json"
      ],
      "evidence_hashes": {